[
  {
    "id": "demo.s01",
    "kind": "scene",
    "title": { "pl": "Kawa", "ru": "Все типы шагов среза" },
    "minutes": 5,
    "npc": "pan_marek",
    "location": "demo.kawiarnia",
    "introduces": ["lx.maly", "lx.slucham", "lx.stol"],
    "warmup": { "fromModules": ["demo"], "count": 1 },
    "skipIf": { "cluster": { "id": "R3", "status": "green" } },
    "short": { "if": { "cluster": { "id": "R3", "status": "yellow" } }, "steps": [0, 1, 3] },
    "steps": [
      { "t": "explain", "md": "**ł** = [ў], как английское w. **l** среднее, не мягкое." },
      { "t": "minimal_pair", "pair": ["łata", "lata"], "play": "random", "cluster": "R3", "item": "mp.lata_lata" },
      { "t": "listen", "say": "mała kawa", "options": ["mała kawa", "mala kawa", "mała kava"], "answer": 0, "item": "lx.maly" },
      { "t": "listen", "say": "kawa", "options": "auto:kawiarnia", "answer": 0, "item": "lx.kawa" },
      { "t": "shadow", "pl": "Mała kawa, proszę.", "repeat": 2 },
      { "t": "say", "who": "pan_marek", "pl": "Słucham?", "ru": "Слушаю?" },
      { "t": "order", "prompt": "Маленький кофе, пожалуйста.", "tiles": ["Mała", "kawa", "proszę", "Mały", "kawę"], "answer": ["Mała", "kawa", "proszę"], "item": "lx.maly" },
      { "t": "choice", "q": "stół это…", "options": ["стол", "стул"], "answer": 0, "item": "lx.stol", "tags": ["ff.stol"], "errorTagByOption": { "1": "ff.stol" } },
      { "t": "type", "prompt": "Маленький кофе, пожалуйста.", "accept": ["Mała kawa, proszę."], "lenient": { "diacritics": "warn" } },
      { "t": "dictation", "say": "stół", "accept": ["stół"], "item": "lx.stol" },
      { "t": "match", "pairs": [["mały", "маленький"], ["stół", "стол"], ["słucham", "слушаю"]], "items": ["lx.maly", "lx.stol", "lx.slucham"] },
      { "t": "gap", "text": "Mała ___, proszę.", "answer": "kawa", "options": ["kawa", "kava"] },
      { "t": "stress", "word": "telefon", "syllables": ["te", "le", "fon"], "answer": 1 }
    ],
    "reward": [{ "setFlag": "demo.s01.done" }, { "line": "bobr.after_kawa" }]
  },
  {
    "id": "demo.boss",
    "kind": "boss",
    "title": { "ru": "Босс демо" },
    "minutes": 3,
    "requires": { "lessonDone": "demo.s01" },
    "pass": { "score": 0.8 },
    "parts": [
      { "id": "a", "title": "Слух", "weight": 0.5, "steps": [{ "t": "minimal_pair", "pair": ["ława", "lawa"], "play": 0, "cluster": "R3", "item": "mp.lawa_lawa" }] },
      { "id": "b", "title": "Смысл", "weight": 0.5, "steps": [{ "t": "choice", "q": "kawa это…", "options": ["кофе", "квас"], "answer": 0, "item": "lx.kawa" }] }
    ]
  }
]
